{
  "$schema": "https://streamflex.dev/schemas/provider/v1.json",
  "schemaVersion": 1,
  "providerVersion": 2,
  "minimumEngineVersion": "1.0.0",

  "id": "netmirror",
  "name": "NetMirror",
  "description": "Movies and TV series with multiple quality options. English and Hindi content.",
  "language": "en",
  "region": "IN", 

  "lifecycle": "beta",
  "status": "online",

  "domains": {
    "primary": "https://net52.cc",
    "mirrors": [
      "https://net50.cc",
      "https://net77.cc"
    ],
    "updatedAt": "2026-10-15"
  },

  "capabilities": {
    "supportsSearch": true,
    "supportsMovies": true,
    "supportsTV": true,
    "supportsAnime": false,
    "supportsDub": false,
    "supportsSub": false,
    "supportsHome": true,
    "supportsMultipleServers": true,
    "supportsDirectLinks": false,
    "supportsDownload": false,
    "supportsSkipIntro": false,
    "supportsResume": false,
    "isSequential": false,
    "sequentialDelayMs": 0
  },

  "endpoints": {
    "searchType": "HTML_PAGE",
    "detailType": "HTML_PAGE",
    "sourceType": "AJAX_JSON"
  },

  "extractorIds": [
    "hubcloud",
    "pixeldrain",
    "dood",
    "streamtape"
  ],

  "priority": 90,
  "fallbackTo": ["vegamovies"],

  "rateLimit": {
    "maxConcurrent": 2,
    "delayBetweenMs": 500
  },

  "testCases": [
    {
      "title": "Inception",
      "year": 2010,
      "tmdbId": 27205,
      "type": "movie",
      "minimumStreams": 1
    }
  ],

  "maintainer": {
    "github": "flex-drivee",
    "addedAt": "2026-07-24",
    "lastVerified": "2026-07-24"
  }
}
